Indicator,Available Dimensions,Description,Title,NA Value,API,Statement,Units
RETEARN,"ARQ,MRQ,ARY,MRY","A component of [EQUITY] representing the cumulative amount of the entities undistributed earnings or deficit. May only be reported annually by certain companies, rather than quarterly.",Accumulated Retained Earnings (Deficit),,"old, new",Balance Sheet,currency
REVENUE,"ARY,ARQ,ART,MRY,MRQ,MRT","Amount of Revenue recognized from goods sold, services rendered, insurance premiums, or other activities that constitute an earning process. Interest income for financial institutions is reported net of interest expense and provision for credit losses.",Revenues,0,"old, new",Income Statement,currency
REVENUEGROWTH1YR,"ART,MRT",Measures the growth in [REVENUE] over the specified period.,Revenue Growth,,old,Metrics,%
REVENUEUSD,"ARY,ARQ,ART,MRY,MRQ,MRT","[REVENUE] in USD, converted by [FXUSD].",Revenues (USD),0,"old, new",Income Statement,USD
RND,"ARY,ARQ,ART,MRY,MRQ,MRT",A component of [OPEX] representing the aggregate costs incurred in a planned search or critical investigation aimed at discovery of new knowledge with the hope that such knowledge will be useful in developing a new product or service.,Research and Development Expense,0,"old, new",Income Statement,currency
ROA,"ART,MRT",Return on assets measures how profitable a company  is [NETINCCMN] relative to its total assets [ASSETSAVG].,Return on Average Assets,,"old, new",Metrics,%
ROE,"ART,MRT",Return on equity measures a corporation's profitability by calculating the amount of [NETINCCMN] returned as a percentage of [EQUITYAVG].,Return on Average Equity,,"old, new",Metrics,%
ROIC,"ART,MRT",Return on Invested Capital is ratio estimated by dividing [EBIT] by [INVCAPAVG]. [INVCAP] is calculated as: [DEBT] plus [ASSETS] minus [INTANGIBLES] minus [CASHNEQ] minus [LIABILITIESC]. Please note this calculation method is subject to change.,Return on Invested Capital,,"old, new",Metrics,%
ROS,"ART,MRT","Return on Sales is a ratio to evaluate a company's operational efficiency, calculated by dividing [EBIT] by [REVENUE]. ROS is often a component of [DUPONTROE].",Return on Sales,,"old, new",Metrics,%
SBCOMP,"ARY,ARQ,ART,MRY,MRQ,MRT","A component of [NCFO] representing the total amount of noncash, equity-based employee remuneration. This may include the value of stock or unit options, amortization of restricted stock or units, and adjustment for officers' compensation. As noncash, this element is an add back when calculating net cash generated by operating activities using the indirect method.",Share Based Compensation,,"old, new",Cash Flow,currency
SGNA,"ARY,ARQ,ART,MRY,MRQ,MRT","A component of [OPEX] representing the aggregate total costs related to selling a firm's product and services, as well as all other general and administrative expenses. Direct selling expenses (for example, credit, warranty, and advertising) are expenses that can be directly linked to the sale of specific products. Indirect selling expenses are expenses that cannot be directly linked to the sale of specific products, for example telephone expenses, Internet, and postal charges. General and administrative expenses include salaries of non-sales personnel, rent, utilities, communication, etc.","Selling, General and Administrative Expense",0,"old, new",Income Statement,currency
SHAREFACTOR,,"Share factor is a multiplicant in the calculation of [MARKETCAP] and is used to adjust for: American Depository Receipts (ADRs) that represent more or less than 1 underlying share; and, companies which have different earnings share for different share classes (eg Berkshire Hathaway - BRKB).",Share Factor,,"old, new",Entity,ratio
SHARESBAS,,"The number of shares or other units outstanding of the entity's capital or common stock or other ownership interests, as stated on the cover of related periodic report (10-K/10-Q), after adjustment for stock splits.",Shares (Basic),,"old, new",Entity,shares
SHARESWA,"ARY,ARQ,ART,MRY,MRQ,MRT","The weighted average number of shares or units issued and outstanding that are used by the company to calculate [EPS], determined based on the timing of issuance of shares or units in the period.",Weighted Average Shares,,"old, new",Income Statement,shares
SHARESWADIL,"ARY,ARQ,ART,MRY,MRQ,MRT","The weighted average number of shares or units issued and outstanding that are used by the company to calculate [EPSDIL], determined based on the timing of issuance of shares or units in the period.",Weighted Average Shares Diluted,,"old, new",Income Statement,shares
SHARESWAGROWTH1YR,"ART,MRT",Measures the growth in [SHARESWA] over the specified period.,Weighted Average Share Growth,,old,Metrics,%
SPS,"ART,MRT",Sales per Share measures the ratio between [REVENUEUSD] and [SHARESWA].,Sales per Share,,"old, new",Metrics,USD/share
TANGIBLES,"ARQ,MRQ,ARY,MRY",The value of tangibles assets calculated as the difference between [ASSETS] and [INTANGIBLES].,Tangible Asset Value,,"old, new",Metrics,currency
TAXASSETS,"ARQ,MRQ,ARY,MRY",A component of [ASSETS] representing tax assets and receivables.,Tax Assets,0,"old, new",Balance Sheet,currency
TAXEFFICIENCY,"ART,MRT",Tax Efficiency is a component of [DUPONTROE] analysis calculated by dividing [NETINC] by [EBT]. This will be 1 when a company does not pay income tax.,Tax Efficiency,,old,Metrics,%
TAXEXP,"ARY,ARQ,ART,MRY,MRQ,MRT",Amount of current income tax expense (benefit) and deferred income tax expense (benefit) pertaining to continuing operations.,Income Tax Expense,0,"old, new",Income Statement,currency
TAXLIABILITIES,"ARQ,MRQ,ARY,MRY",A component of [LIABILITIES] representing outstanding tax liabilities.,Tax Liabilities,0,"old, new",Balance Sheet,currency
TBVPS,"ARQ,MRQ,ARY,MRY",Measures the ratio between [TANGIBLES] and [SHARESWA].,Tangible Assets Book Value per Share,,"old, new",Metrics,currency/share
TICKER,,"The ticker is a unique identifer for a company in the database, available as a column field in the new datatable API. For additional meta data see the ticker listing: http://www.sharadar.com/meta/tickers.txt or http://www.sharadar.com/meta/tickers.json",Ticker,,new,Entity,
WORKINGCAPITAL,"ARQ,MRQ,ARY,MRY",Working capital measures the difference between [ASSETSC] and [LIABILITIESC].,Working Capital,,"old, new",Metrics,currency
